{
  "catalogInfo": {
    "title": "Flyberry Gourmet Gifting Catalogue 2025",
    "source": "GIFTING CATALOUGE_11zon.pdf",
    "type": "Corporate Gifting & Premium Products Catalog",
    "pages": 24,
    "extractionDate": "2025-10-23",
    "priceRange": {
      "min": 399,
      "max": 7249,
      "currency": "INR"
    },
    "totalProducts": 22,
    "customizable": true
  },
  "fortune500Clients": {
    "technology": [
      {
        "name": "Google",
        "category": "Technology"
      },
      {
        "name": "Facebook",
        "category": "Technology"
      },
      {
        "name": "Accenture",
        "category": "Technology/Consulting"
      }
    ],
    "financialServices": [
      {
        "name": "Goldman Sachs",
        "category": "Investment Banking"
      },
      {
        "name": "Citibank",
        "category": "Banking"
      },
      {
        "name": "Societe Generale",
        "category": "Banking"
      },
      {
        "name": "Motilal Oswal",
        "category": "Financial Services"
      }
    ],
    "consulting": [
      {
        "name": "Deloitte",
        "category": "Consulting"
      }
    ],
    "manufacturing": [
      {
        "name": "Tata Steel",
        "category": "Steel/Manufacturing"
      },
      {
        "name": "Ultratech Cement",
        "category": "Cement/Construction"
      },
      {
        "name": "Coca-Cola",
        "category": "Beverages"
      }
    ],
    "pharmaceuticals": [
      {
        "name": "Alkem",
        "category": "Pharmaceuticals"
      },
      {
        "name": "Macleods",
        "category": "Pharmaceuticals"
      }
    ],
    "hospitality": [
      {
        "name": "Marriott",
        "category": "Hospitality"
      },
      {
        "name": "Taj Hotels",
        "category": "Hospitality"
      }
    ]
  },
  "distributionChannels": {
    "ecommerce": ["BigBasket", "Amazon.in", "Flipkart"],
    "offlineStores": [
      "Spencer's",
      "Ratnadeep",
      "Pure O Natural",
      "Namdhari's Fresh",
      "Almond House",
      "Q Mart"
    ],
    "exclusiveOutlets": {
      "count": 5,
      "locations": ["Hyderabad", "Vijayawada"]
    },
    "alternateChannels": ["Afar (Hyderabad Airport)", "Churrolto"]
  },
  "addOns": {
    "stuffedDates": {
      "pricePerPiece": 80,
      "weightPerPiece": "35g",
      "shelfLife": "30 days",
      "varieties": [
        {
          "name": "The Blueberry Cheese Date",
          "ingredients": ["Medjoul Date", "Blueberries", "Cream Cheese"]
        },
        {
          "name": "The Orange Surprise Date",
          "ingredients": ["Medjoul Date", "Orange", "Pistachio"]
        },
        {
          "name": "The Chocodate",
          "ingredients": ["Medjoul Date", "Chocolate", "Almonds", "Ginger"]
        },
        {
          "name": "The Paan Perfect Date",
          "ingredients": ["Medjoul Date", "Paan mix", "Coconut", "Gulkand", "Seeds"]
        },
        {
          "name": "The PB & Yay Date",
          "ingredients": ["Medjoul Date", "Peanut Butter", "Millet Crisps", "Choco chips"]
        }
      ]
    },
    "dateBites": {
      "pricePerPiece": 45,
      "weightPerPiece": "30g",
      "shelfLife": "30 days",
      "varieties": [
        {
          "name": "Mocamaze",
          "ingredients": ["Pecan Nuts", "Dates", "Almonds"]
        },
        {
          "name": "Matcha Madness",
          "ingredients": ["Matcha", "Cashews", "Medjoul Dates", "Coconut", "Pistachio"]
        },
        {
          "name": "Choconut",
          "ingredients": ["Medjoul Dates", "Almonds", "Cacao"]
        },
        {
          "name": "Newberry",
          "ingredients": ["Blueberry", "Medjoul Dates", "Sesame Seeds", "Cashews"]
        },
        {
          "name": "Cocogo",
          "ingredients": ["Medjoul Dates", "Cashews", "Hemp Hearts"]
        }
      ]
    }
  },
  "giftBoxes": [
    {
      "productId": "GB-001",
      "name": "Lattice Box",
      "mrp": 399,
      "contents": ["Almonds", "Cashews", "Raisins", "Dates"],
      "portionSize": "40g each",
      "netWeight": "160g",
      "design": "White box with golden/pink geometric lattice pattern",
      "tier": "Premium Entry",
      "customizable": true
    },
    {
      "productId": "GB-002",
      "name": "Ginkgo Box",
      "mrp": 549,
      "contents": ["Almonds", "Cashews", "Raisins", "Pistachio"],
      "portionSize": "50g each",
      "netWeight": "200g",
      "design": "Pastel ginkgo leaf pattern (pink, yellow, blue tones)",
      "tier": "Premium Entry",
      "customizable": true
    },
    {
      "productId": "GB-003",
      "name": "Lotus Case",
      "mrp": 599,
      "contents": ["Almonds", "Cashews", "Raisins", "Chocolate Biscotti Balls"],
      "portionSize": "50g each",
      "netWeight": "200g",
      "design": "Pink lotus flower illustration on lid",
      "tier": "Premium Entry",
      "customizable": true
    },
    {
      "productId": "GB-004",
      "name": "Nautical Box",
      "mrp": 549,
      "contents": ["Almonds", "Peri Peri Cashews", "Dates", "Cranberries Seed Mix"],
      "portionSize": "60g each",
      "netWeight": "240g",
      "design": "Blue and golden striped geometric pattern",
      "tier": "Premium Entry",
      "customizable": true
    },
    {
      "productId": "GB-005",
      "name": "Fleur Box",
      "mrp": 649,
      "contents": ["Almonds", "Cashews", "Walnuts", "Pistachio"],
      "portionSize": "60g each",
      "netWeight": "240g",
      "design": "Pink outer box with yellow marigold flowers and white daisies",
      "tier": "Premium Entry",
      "customizable": true
    },
    {
      "productId": "GB-006",
      "name": "Small Cadeau Case",
      "mrp": 799,
      "contents": ["Chocolate Almonds", "Peri Peri Cashews", "Masala Cranberries", "Roasted Seed Mix"],
      "portionSize": "75g each",
      "netWeight": "240g",
      "design": "Blue outer sleeve with magenta geometric art deco pattern",
      "tier": "Mid-Premium",
      "customizable": true
    },
    {
      "productId": "GB-007",
      "name": "Flip Top Box",
      "mrp": 1049,
      "contents": ["Roasted Almonds", "Spiced Seed Mix", "Chatpata Fruit Mix", "Chocolate Biscotti Balls"],
      "portionSize": "100g each",
      "netWeight": "400g",
      "design": "Purple and orange Indian festival theme with Diwali illustration",
      "includes": ["Flip book"],
      "message": "As Diwali lights up all doors, may it also light up the path to success, good health, prosperity and loads of happiness for you.",
      "tier": "Mid-Premium",
      "customizable": true,
      "bulkOrderOnly": true
    },
    {
      "productId": "GB-008",
      "name": "Tower Box",
      "mrp": 1199,
      "contents": ["Almonds", "Cashews", "Raisins", "Pistachio"],
      "portionSize": "110g each",
      "netWeight": "440g",
      "design": "Blue and golden geometric pattern (art deco style), stackable",
      "tier": "Mid-Premium",
      "customizable": true
    },
    {
      "productId": "GB-009",
      "name": "Memory Box",
      "mrp": 1299,
      "contents": ["Roasted Almonds", "Cranberries Seed Mix", "Apricots", "Chocolate Biscotti Balls"],
      "portionSize": "120g each",
      "netWeight": "480g",
      "design": "Yellow box with colorful Indian folk art mandala pattern",
      "includes": ["Flip book", "Diya 1pc"],
      "tier": "Premium",
      "customizable": true,
      "bulkOrderOnly": true
    },
    {
      "productId": "GB-010",
      "name": "Hope Box",
      "mrp": 1699,
      "contents": ["Roasted Salted Almonds", "Dates", "Spiced Seed Mix", "Dark Chocolate"],
      "portionSize": "100g each",
      "netWeight": "500g",
      "design": "Cylindrical box with colorful pandemic-themed illustration",
      "theme": "Post-COVID hope and resilience",
      "tier": "Premium",
      "customizable": true,
      "bulkOrderOnly": true
    },
    {
      "productId": "GB-011",
      "name": "Large Cadeau Case - Standard",
      "mrp": 1559,
      "contents": {
        "Nut Mix": "100g each",
        "Berry Mix": "100g",
        "Seed Mix": "100g",
        "Veggie Chips Mix": "25g",
        "Date Fudge": "100g"
      },
      "netWeight": "425g",
      "design": "Sleek blue/white outer box with magenta geometric art deco pattern",
      "tagline": "WHO SAID HEALTHY COULDN'T BE TASTY?",
      "features": ["100% Natural", "No Added Sugar", "No Preservatives"],
      "tier": "Luxury",
      "customizable": true
    },
    {
      "productId": "GB-012",
      "name": "Large Cadeau Case - Large",
      "mrp": 2499,
      "contents": {
        "Nut Mix": "150g each",
        "Berry Mix": "150g",
        "Seed Mix": "150g",
        "Veggie Chips Mix": "50g",
        "Date Fudge": "200g"
      },
      "netWeight": "700g",
      "design": "Sleek blue/white outer box with magenta geometric art deco pattern",
      "tagline": "WHO SAID HEALTHY COULDN'T BE TASTY?",
      "features": ["100% Natural", "No Added Sugar", "No Preservatives"],
      "tier": "Luxury",
      "customizable": true
    },
    {
      "productId": "GB-013",
      "name": "Netted Basket",
      "mrp": 1949,
      "contents": ["Dates", "Almonds", "Cashews", "Raisins", "Flyberry Okra Chips", "Corn Chips", "Date Fudge"],
      "includes": ["2 Diyas"],
      "netWeight": "600g",
      "design": "Wicker basket with golden organza wrap and yellow ribbon",
      "tier": "Luxury",
      "customizable": true
    },
    {
      "productId": "GB-014",
      "name": "Assorted Dry Fruit Box",
      "mrp": 599,
      "contents": {
        "Deri Dates": "50g",
        "Apricots": "50g",
        "Nut Mix": "50g",
        "Raisins": "50g",
        "Fruit Mix": "50g"
      },
      "netWeight": "250g",
      "design": "Bright orange box with colorful fruit illustrations",
      "tier": "Premium Entry",
      "customizable": true
    },
    {
      "productId": "GB-015",
      "name": "Re-usable Jute Bag",
      "mrp": 1369,
      "contents": {
        "Deri Dates": "140g",